NO CLIENTE,FACTURA,NOMBRE DEL CLIENTE,DESTINO,PROGRAMACION,ESTATUS,FECHA DE ENVIO,SURTIDOR,PAQUETERIA,INCIDENCIA
C07337,237981,HOTEL EXTENDED SUITES COATZACOALCOS FORUM,"COATZACOALCOS, VER",07/05/2026,ENVIADO,07/05/2026,KEVIN,TRES GUERRAS,
C07334,237982,EXTENDED SUITES CIUDAD DEL CARMEN AEROPUERTO,"DEL CARMEN, CAM",07/05/2026,ENVIADO,07/05/2026,KEVIN,TRES GUERRAS,
C05429,237983,ALILA MAYAKOBA,"PLAYA DEL CARMEN, QR",07/05/2026,DETENIDO,,,,de playa
C07341,237984,EXTENDED SUITES CHIHUAHUA LA JUVENTUD,"CHIHUAHUA, CHI",07/05/2026,ENVIADO,07/05/2026,KEVIN,TRES GUERRAS,
C07340,237985,EXTENDED SUITES CANCUN LAS CUMBRES,"CANCUN, QR",07/05/2026,DETENIDO,,,,
C03362,237986,EXTENDED SUITES MERIDA,"MERIDA, YUC",07/05/2026,ENVIADO,07/05/2026,KEVIN,TRES GUERRAS,
C06946,237987,HOTEL SUITES AMD,"SAN JUAN DE LOS LAGOS, JAL",07/05/2026,ENVIADO,07/05/2026,KEVIN,TRES GUERRAS,
C09742,237988,HARD ROCK RIVIERA MAYA ( 3402 ),"PLAYA DEL CARMEN, QR",07/05/2026,DETENIDO,,,,
C02411,237989,LA QUINTA CD JUAREZ,"CD. JUAREZ, CHI",07/05/2026,ENVIADO,07/05/2026,KEVIN,TRES GUERRAS,
C08240,237990,STADIA SUITES MEXICO SANTA FE,"CUAJIMALPA DE MORELOS, CMX",07/05/2026,ENVIADO,07/05/2026,KEVIN,TRES GUERRAS,
C06129,237991,HOTEL SALON BAHIA,"TEXCOCO, MEX",07/05/2026,ENVIADO,07/05/2026,KEVIN,TRES GUERRAS,
C09005,237992,SAMSON WATERS,"PUERTO VALLARTA, JAL",07/05/2026,ENVIADO,07/05/2026,KEVIN,SANCHEZ,
C00696,237993,MOTEL MARQUIS,"TLAJOMULCO DE ZUÃ‘IGA, JAL",07/05/2026,ENVIADO,07/05/2026,FELIX,,
C09001,237994,MOTEL LOVE GDL,"GUADALAJARA, JAL",07/05/2026,ENVIADO,7/05/26,KEVIN,,
C07257,237995,CITY CENTRO CIUDAD DE MEXICO (CCMEX),"CIUDAD DE MEXICO, CMX",07/05/2026,ENVIADO,07/05/2026,KEVIN,TRES GUERRAS,
C08190,237996,MOTEL VILLAMAGNA,"JUAREZ, NL",07/05/2026,ENVIADO,07/05/2026,KEVIN,TRES GUERRAS,
C06416,237997,CHN MONTERREY AEROPUERTO,"APODACA, NL",07/05/2026,ENVIADO,07/05/2026,KEVIN,TRES GUERRAS,
C03447,237998,"HAMPTON GUADALAJARA-AEROPUERTO, MEXICO (GDLHA)","EL SALTO, JAL",07/05/2026,ENVIADO,07/05/2026,KEVIN,,
C07037,237999,MICROTEL CULIACAN,"CULIACAN, SIN",07/05/2026,ENVIADO,07/05/2026,KEVIN,TINY,
C08341,238000,"DOUBLETREE MEXICO CITY SANTA FE, MEXICO (MEXST)",", CMX",07/05/2026,ENVIADO,07/05/2026,KEVIN,TRES GUERRAS,
C09404,238001,HOTEL PLAZA CARIBE,"SM 23, QR",07/05/2026,DETENIDO,,,,
C01874,238002,HOLIDAY INN EXPRESS & SUITES MONTERREY AEROPUERTO(MTYZO),"APODACA, NL",07/05/2026,DETENIDO,,,,
C09759,238003,HOTEL GREEN PARK,"ALC MIGUEL HIDALGO, CMX",07/05/2026,DETENIDO,,,,SOLO FACTURA
C08244,238004,CITY EXPRESS PLUS CANCUN AEROPUERTO RIVIERA  (CPCHC),"CANCUN, QR",07/05/2026,DETENIDO,,KEVIN,TRES GUERRAS,CEDIS CANCUN
C02052,238005,HOTEL SAN MARCOS,"SAN CRISTOBAL DE LAS CASAS, CHS",07/05/2026,ENVIADO,07/05/2026,KEVIN,TRES GUERRAS,
C03997,238006,HOTEL MARIELENA,"CUATROCIENEGAS, COA",07/05/2026,ENVIADO,07/05/2026,KEVIN,TRES GUERRAS,
CLIESP,238007,VENTAS DE MOSTRADOR,"GUADALAJARA, JAL",07/05/2026,ENVIADO,07/05/2026,KEVIN,,
CG0024,238008,FARMASES,"MONTERREY, NL",07/05/2026,DETENIDO,,,,
C09286,238009,HOTEL BOUTIQUE FINCA GARULLO,"MARTINEZ DE LA TORRE, VER",07/05/2026,ENVIADO,07/05/2026,KEVIN,TRES GUERRAS,
C08070,238010,CROWNE PLAZA TOLUCA (TLUCP),"METEPEC, MEX",07/05/2026,ENVIADO,07/05/2026,KEVIN,ONE,
C00023,238011,HOTEL WESTIN GUADALAJARA A0096864,"GUADALAJARA, JAL",07/05/2026,ENVIADO,07/05/2026,FELIX,,
C01663,238012,ARRENDADORA GALA,"LAZARO CARDENAS, MCH",07/05/2026,ENVIADO,07/05/2026,KEVIN,TRES GUERRAS,
C08692,238013,ANAIS JAZMIN ROSAS ESPARZA,"TLAJOMULCO DE ZUÃ‘IGA, JAL",07/05/2026,ENVIADO,07/05/2026,KEVIN,,
C09496,238014,HOTEL PARAISO EXPRESS,"TORREON COAHUILA, COA",07/05/2026,ENVIADO,07/05/2026,KEVIN,TINY,
CG0029,238015,HOTEL HACIENDA DEL ROBLE,"AGUASCALIENTES, AGS",07/05/2026,ENVIADO,07/05/2026,KEVIN,ONE,
C03135,238016,COURTYARD BY MARRIOTT LEON AT THE POLIFORUM  A0101010,"LEON, GTO",07/05/2026,ENVIADO,07/05/2026,KEVIN,TRES GUERRAS,
C03073,238017,COURTYARD MARRIOTT SAN LUIS POTOSI A0152894,"SAN LUIS POTOSI, SLP",07/05/2026,ENVIADO,07/05/2026,KEVIN,TRES GUERRAS,
C07159,238018,CITY EXPRESS TEPIC (CETPQ),"TEPIC, NAY",07/05/2026,ENVIADO,07/05/2026,KEVIN,TINY,
C08357,238019,"HILTON GUADALAJARA MIDTOWN, MEXICO (GDLGM)","GUADALAJARA, JAL",07/05/2026,ENVIADO,07/05/2026,KEVIN,,
C04349,238020,COURTYARD MARRIOT QUERETARO A0093637,"SANTIAGO DE QUERETARO, QUE",07/05/2026,ENVIADO,07/05/2026,KEVIN,TRES GUERRAS,
CF0007,238021,REAL INN PERINORTE,"TLALNEPANTLA, MEX",07/05/2026,ENVIADO,07/05/2026,KEVIN,TRES GUERRAS,
C09366,238022,COMFORT INN PITIC HERMOSILLO (152792),"HERMOSILLO, SON",07/05/2026,ENVIADO,07/05/2026,KEVIN,TINY,
C08714,238023,HELIOS COLOMBIA,", BOG",07/05/2026,DETENIDO,,,,EXPORTACION
C08714,238024,HELIOS COLOMBIA,", BOG",07/05/2026,DETENIDO,,,,EXPORTACION
C01474,238025,COURTYARD MEXICO CITY REVOLUCION,"CDMX, CMX",07/05/2026,ENVIADO,07/05/2026,KEVIN,TRES GUERRAS,
C07058,238026,FAIRFIELD INN AND SUITES SILAO,"SILAO, GTO",07/05/2026,ENVIADO,07/05/2026,KEVIN,TRES GUERRAS,
C06597,238027,COUTYARD MARRIOT HERMOSILLO A0095790,"HERMOSILLO, SON",07/05/2026,ENVIADO,07/05/2026,KEVIN,TINY,
CP0015,238028,HOTEL MARIA JOSE,"ZAPOPAN, JAL",07/05/2026,ENVIADO,07/05/2026,KEVIN,,
C09421,238029,GRUPO AGC,"GUADALAJARA, JAL",07/05/2026,DETENIDO,,,,AGC
C02574,238030,HOTEL AEROPUERTO MORELIA,"MUNICIPIO ALVARO OBREGON, MCH",07/05/2026,ENVIADO,07/05/2026,KEVIN,TRES GUERRAS,
C07318,238031,CITY EXPRESS LOS MOCHIS (CELMM),"LOS MOCHIS, SIN",07/05/2026,ENVIADO,07/05/2026,KEVIN,TINY,
C08473,238032,"HILTON GARDEN INN MONTERREY OBISPADO, NUEVO LEON, MEXICO (MTYGI)","MONTERREY, NL",07/05/2026,ENVIADO,8/05/26,KEVIN,ONE,
C08865,238033,JAVA MOTEL BOUTIQUE,"GUADALAJARA, JAL",07/05/2026,ENVIADO,8/05/26,KEVIN,,
C01509,238034,"CURIO - A COLLECTION BY HILTON MS MILENIUM MONTERREY, MEXICO (MTYMM)","SAN PEDRO GARZA GARCIA, NL",07/05/2026,ENVIADO,8/05/26,KEVIN,TRES GUERRAS,
C05374,238035,"HAMPTON DURANGO, MEXICO (DGOHX)","DURANGO, DUR",07/05/2026,ENVIADO,8/05/26,KEVIN,TRES GUERRAS,
C05503,238036,FIESTA AMERICANA GRAND LOS CABOS (FALC),"CABO SAN LUCAS, BCS",07/05/2026,ENVIADO,8/05/26,FELIX,TRES GUERRAS,
C08383,238037,"HILTON GARDEN INN CHIHUAHUA, CHIHUAHUA, MEXICO (CUUCM)","CHIHUAHUA, CHI",07/05/2026,ENVIADO,8/05/26,KEVIN,TRES GUERRAS,
C05481,238038,FIESTA AMERICANA GUADALAJARA FAGD,"GUADALAJARA, JAL",07/05/2026,PENDIENTE,,,,
C05813,238039,SLEEP INN MONTERREY SAN PEDRO (143233),"MONTERREY, NL",07/05/2026,ENVIADO,8/05/26,KEVIN,TRES GUERRAS,
C05503,238040,FIESTA AMERICANA GRAND LOS CABOS (FALC),"CABO SAN LUCAS, BCS",07/05/2026,ENVIADO,8/05/26,FELIX,TRES GUERRAS,
C03977,238041,HOLIDAY INN EXPRESS CABO SAN LUCAS (SJDL),"CABO SAN LUCAS, BCS",07/05/2026,ENVIADO,8/05/26,KEVIN,TRES GUERRAS,
C01774,238042,HOTEL STORE PUERTO VALLARTA,"BAHIA DE BANDERAS, NAY",07/05/2026,PENDIENTE,,,,
C05503,238043,FIESTA AMERICANA GRAND LOS CABOS (FALC),"CABO SAN LUCAS, BCS",07/05/2026,ENVIADO,8/05/26,FELIX,TRES GUERRAS,
C09529,238044,PRESIDENTE INTERCONTINENTAL MONTERREY,"SAN PEDRO GARZA GARCÃA, NL",07/05/2026,ENVIADO,8/05/26,KEVIN,ONE,
C09544,238045,RED LOVE,"TIJUANA, BC",07/05/2026,DETENIDO,,,,DETENIDA
C04964,238046,HILTON GRAND VACATIONS LA PACIFICA LOS CABOS BY HILTON CLUB (SJDGV),"SAN JOSE DEL CABO, BCS",07/05/2026,ENVIADO,8/05/26,KEVIN,TRES GUERRAS,
C08102,238047,DREAMS NATURA RIVIERA CANCUN (DRENA) A0191039,"CANCUN, QR",07/05/2026,ENVIADO,8/05/26,KEVIN,TRES GUERRAS,
C08479,238048,AVID TIJUANA OTAY(TIJAV),"TIJUANA, BC",07/05/2026,ENVIADO,8/05/26,KEVIN,TRES GUERRAS,
C05359,238049,FIESTA AMERICANA HERMOSILLO (FAHE),"HERMOSILLO, SON",07/05/2026,ENVIADO,07/05/2026,KEVIN,TRES GUERRAS,
C05941,238050,HOTEL CASA BLANCA CHETUMAL,"CHETUMAL, QR",07/05/2026,DETENIDO,,,,NO ENTREGADA
C02569,238051,ONE GUADALAJARA CENTRO HISTORICO (1GDCE),"GUADALAJARA, JAL",07/05/2026,PENDIENTE,,,,
C09398,238052,FIESTA AMERICANA RIVIERA NAYARIT (FARN),"BAHIA DE BANDERAS, NAY",07/05/2026,DETENIDO,,,,NO ENTREGADA
C05503,238053,FIESTA AMERICANA GRAND LOS CABOS (FALC),"CABO SAN LUCAS, BCS",07/05/2026,ENVIADO,8/05/26,FELIX,TRES GUERRAS,
C02635,238054,CITY EXPRESS CIUDAD DEL CARMEN (CECME ),"DEL CARMEN, CAM",07/05/2026,PENDIENTE,,,,
C07245,238055,CITY EXPRESS TUXPAN (CETXP),"TUXPAN, VER",07/05/2026,ENVIADO,8/05/26,FELIX,TRES GUERRAS,
C07391,238056,CITY EXPRESS PLUS TIJUANA TOREO (CPTIJ),"TIJUANA, BC",07/05/2026,ENVIADO,8/05/26,KEVIN,TRES GUERRAS,
C08667,238057,HILTON QUERETARO,"QUERETARO, QUE",07/05/2026,ENVIADO,8/05/26,KEVIN,TRES GUERRAS,
C02470,238058,ROYAL AUTO HOTEL,"MINATITLAN, VER",07/05/2026,ENVIADO,8/05/26,KEVIN,TRES GUERRAS,
C08607,238059,HOTEL FLAMINGOS,"GUADALAJARA, JAL",07/05/2026,ENVIADO,9/05/26,FELIX,,
C08711,238060,CABAÃ‘AS LUPITA,"MAZAMITLA, JAL",07/05/2026,PENDIENTE,,,,
C09366,238061,COMFORT INN PITIC HERMOSILLO (152792),"HERMOSILLO, SON",07/05/2026,ENVIADO,07/05/2026,KEVIN,TINY,
C00353,238062,EMPORIO VERACRUZ,"VERACRUZ, VER",07/05/2026,ENVIADO,8/05/26,KEVIN,TRES GUERRAS,
C07246,238063,CITY PLUS GUADALAJARA PALOMAR (CEGDP),"TLAJOMULCO DE ZUÃ‘IGA, JAL",07/05/2026,ENVIADO,9/05/26,FELIX,,
C07879,238064,HOLIDAY INN EXPRESS & SUITES MONTERREY SENDERO NORTE,"CDAD. GRAL. ESCOBEDO, NL",07/05/2026,PENDIENTE,,,,
C05991,238065,VN HOTEL,"MONTERREY, NL",07/05/2026,ENVIADO,8/05/26,KEVIN,TRES GUERRAS,
C02081,238066,EMPORIO ZACATECAS,"ZACATECAS, ZAC",07/05/2026,PENDIENTE,,,,
C04827,238067,"HILTON SAN LUIS POTOSI, MEXICO (SLPHH)","SAN LUIS POTOSI, SLP",07/05/2026,ENVIADO,8/05/26,KEVIN,TRES GUERRAS,
C03764,238068,HOLIDAY INN MONTERREY VALLE(MTYZV),"SAN PEDRO GARZA GARCIA, NL",07/05/2026,ENVIADO,8/05/26,KEVIN,TRES GUERRAS,
C02400,238069,CASA INN PREMIUM HOTEL QUERETARO,"EL MARQUES, QUE",07/05/2026,ENVIADO,8/05/26,KEVIN,TRES GUERRAS,
C08637,238070,HOTEL LA ESTANCIA,"ZAPOPAN, JAL",07/05/2026,PENDIENTE,,,,
C09117,238071,GRAND CATALAGUA,"MORELIA, MCH",07/05/2026,ENVIADO,8/05/26,KEVIN,TRES GUERRAS,
C07280,238072,CITY EXPRESS MONTERREY SANTA CATARINA (CEMTY),"SANTA CATARINA, NL",07/05/2026,ENVIADO,9/05/26,FELIX,,
C08429,238073,CITY EXPRES PLUS MEXICALI (CPMXL),"MEXICALI, BC",07/05/2026,ENVIADO,8/05/26,KEVIN,TRES GUERRAS,
C02635,238074,CITY EXPRESS CIUDAD DEL CARMEN (CECME ),"DEL CARMEN, CAM",07/05/2026,ENVIADO,8/05/26,KEVIN,TRES GUERRAS,
C01770,238075,CITY EXPRESS TEPOTZOTLAN (CETPO),"TEPOTZOTLAN, MEX",07/05/2026,ENVIADO,8/05/26,KEVIN,TRES GUERRAS,
C07879,238076,HOLIDAY INN EXPRESS & SUITES MONTERREY SENDERO NORTE,"CDAD. GRAL. ESCOBEDO, NL",07/05/2026,ENVIADO,8/05/26,KEVIN,TRES GUERRAS,
C01774,238079,HOTEL STORE PUERTO VALLARTA,"BAHIA DE BANDERAS, NAY",08/05/2026,PENDIENTE,,,,
C00169,238081,HOTEL LA FINCA,"CATEMACO, VER",08/05/2026,ENVIADO,8/05/26,KEVIN,TRES GUERRAS,
C09640,238082,CITY JUNIOR ZONA INDUSTRIAL (CJTCC),"TOLUCA, DF2",08/05/2026,ENVIADO,8/05/26,KEVIN,TRES GUERRAS,
C07268,238083,CITY EXPRESS GUSTAVO BAZ (CEBAZ),"TLANEPANTLA, MEX",08/05/2026,ENVIADO,8/05/26,KEVIN,TRES GUERRAS,
C07164,238084,CITY JUNIOR VILLAHERMOSA (CJVSA),"VILLAHERMOSA, TAB",08/05/2026,ENVIADO,8/05/26,KEVIN,TRES GUERRAS,
C07241,238085,CITY EXPRESS MATAMOROS (CEMAT),"MATAMOROS, TAM",08/05/2026,ENVIADO,9/05/26,FELIX,PAQMEX,
C07418,238086,CITY EXPRESS PLUS INTERLOMAS (CPINT),"HUIXQUILUCAN, CMX",08/05/2026,ENVIADO,8/05/26,KEVIN,TRES GUERRAS,
C07223,238088,CITY JUNIOR GUADALAJARA PERIFERICO SUR (CJGPS),"TLAQUEPAQUE, JAL",08/05/2026,ENVIADO,9/05/26,FELIX,,
C07318,238089,CITY EXPRESS LOS MOCHIS (CELMM),"LOS MOCHIS, SIN",08/05/2026,ENVIADO,8/05/26,KEVIN,TINY,
C07221,238090,CITY JUNIOR TIJUANA OTAY (CJTIO),"TIJUANA, BC",08/05/2026,ENVIADO,8/05/26,KEVIN,TRES GUERRAS,
C07351,238091,CITY EXPRESS SALTILLO SUR (CESLW),"SALTILLO, COA",08/05/2026,ENVIADO,8/05/26,KEVIN,TRES GUERRAS,
C07278,238092,CITY EXPRESS QUERETARO (CEQRO),"QUERETARO, QUE",08/05/2026,ENVIADO,8/05/26,KEVIN,TRES GUERRAS,
C07401,238093,CITY EXPRESS ENSENADA (CEESE),"ENSENADA, BC",08/05/2026,ENVIADO,8/05/26,KEVIN,TRES GUERRAS,
C07159,238094,CITY EXPRESS TEPIC (CETPQ),"TEPIC, NAY",08/05/2026,ENVIADO,8/05/26,KEVIN,TINY,
C07266,238095,CITY EXPRESS VERACRUZ (CEVER),"BOCA DEL RIO, VER",08/05/2026,ENVIADO,8/05/26,KEVIN,TRES GUERRAS,
C07589,238096,CITY EXPRESS CENTRAL DE ABASTOS (CECEA),"CIUDAD DE MEXICO, CMX",08/05/2026,ENVIADO,8/05/26,KEVIN,TRES GUERRAS,
C07307,238097,CITY EXPRESS SALTILLO NORTE (CESAL),"SALTILLO, COA",08/05/2026,ENVIADO,8/05/26,KEVIN,TRES GUERRAS,
C07304,238099,CITY EXPRESS MONTERREY AEROPUERTO (CEMTA),"APODACA, NL",08/05/2026,ENVIADO,8/05/26,KEVIN,TRES GUERRAS,
C07575,238100,CITY EXPRESS PLUS PATIO UNIVERSITARIO (CEPUN),"BENITO JUAREZ, CMX",08/05/2026,ENVIADO,8/05/26,KEVIN,TRES GUERRAS,
C07214,238101,CITY EXPRESS CAMPECHE (CECPE),"SAN FRANCISCO DE CAMPECHE, CAM",08/05/2026,ENVIADO,8/05/26,KEVIN,TRES GUERRAS,
C05754,238102,HOLIDAY INN EXPRESS & SUITES MONTERREY VALLE (MTYRR),"SAN PEDRO GARZA GARCIA, NL, NL",08/05/2026,ENVIADO,8/05/26,KEVIN,TRES GUERRAS,
C08091,238103,HOLIDAY INN EXPRESS & SUITES CELAYA (BJXCE),"CELAYA, GTO",08/05/2026,ENVIADO,8/05/26,KEVIN,TRES GUERRAS,
C08700,238104,AUTOHOTEL VILLAVERDE,"VILLAHERMOSA CENTRO, TAB",08/05/2026,ENVIADO,8/05/26,KEVIN,TRES GUERRAS,
C03428,238105,HOLIDAY INN BUENAVISTA (MEXBU),"CUAUHTEMOC, CMX",08/05/2026,ENVIADO,8/05/26,FELIX,TRES GUERRAS,
C08267,238106,MICROTEL GUADALAJARA SUR,"TLAJOMULCO DE ZUÑIGA, JAL",08/05/2026,ENVIADO,9/05/26,,,
C07187,238107,CITY EXPRESS IRAPUATO (CEIRA),"IRAPUATO, GTO",08/05/2026,ENVIADO,8/05/26,KEVIN,TRES GUERRAS,
C05818,238108,RAMADA ENCORE PUEBLA A0191476,"CORONANGO, PUE",08/05/2026,ENVIADO,8/05/26,KEVIN,TRES GUERRAS,
C07020,238109,ENCORE AGUASCALIENTES A0191473,"AGUASCALIENTES, AGS",08/05/2026,ENVIADO,8/05/26,KEVIN,TRES GUERRAS,
C07171,238110,CITY EXPRESS SALINA CRUZ (CESCX),"SALINA CRUZ, OAX",08/05/2026,ENVIADO,8/05/26,KEVIN,TRES GUERRAS,
CLIESP,238111,VENTAS DE MOSTRADOR,"GUADALAJARA, JAL",08/05/2026,PENDIENTE,,,,
C07277,238113,CITY EXPRESS CANANEA (CECNA),"CANANEA, SON",08/05/2026,ENVIADO,8/05/26,KEVIN,TINY,
C07574,238114,CITY EXPRESS CELAYA (CECEL),"CELAYA, GTO",08/05/2026,ENVIADO,8/05/26,KEVIN,TRES GUERRAS,
C07183,238115,CITY EXPRESS COMITAN (CECJT),"COMITÁN DE DOMÍNGUEZ, CHS",08/05/2026,ENVIADO,8/05/26,KEVIN,TRES GUERRAS,
