NO CLIENTE,FACTURA,NOMBRE DEL CLIENTE,DESTINO,PROGRAMACION,ESTATUS,FECHA DE ENVIO,SURTIDOR,PAQUETERIA,INCIDENCIA
C00452,238492,SLEEP INN MEXICALI (143230),"MEXICALI, BC",15/05/2026,PENDIENTE,,,,
C00061,238493,HOTEL DE MENDOZA,"GUADALAJARA, JAL",15/05/2026,PENDIENTE,,,,
C06624,238494,COUTYARD MARRIOT VILLAHERMOSA TABASCO A0099667,"VILLAHERMOSA, TAB",15/05/2026,PENDIENTE,15/05/26,KEVIN,TRES GUERRAS,
C09771,238495,ARMANDO YAEL MARROQUIN AYALA,"CUAHTEMOC, CMX",15/05/2026,PENDIENTE,,,,
C09771,238496,ARMANDO YAEL MARROQUIN AYALA,"CUAHTEMOC, CMX",15/05/2026,PENDIENTE,,,,
C09772,238497,LUIS CARLOS GARCIA DELGADO,"MIGUEL HIDALGO, CMX",15/05/2026,PENDIENTE,,,,
C09773,238498,JOSE ALEJANDRO SOSA GAMBOA,"MERIDA, YUC",15/05/2026,PENDIENTE,,,,
C05518,238499,HOLIDAY INN EXPRESS XALAPA (JALEX),"XALAPA ENRIQUEZ, VER",15/05/2026,ENVIADO,15/05/26,KEVIN,TRES GUERRAS,
C09411,238500,HOLIDAY INN CUERNAVACA (CVJMX),"CUERNAVACA, MOR",15/05/2026,ENVIADO,15/05/26,KEVIN,TRES GUERRAS,
C09128,238501,CASA LERDO HOTEL BOUTIQUE,"ZAPOPAN, JAL",15/05/2026,ENVIADO,15/05/26,FELIX,TRES GUERRAS,
C07361,238502,HOTEL MARTINAS,"PUERTO ESCONDIDO, OAX",15/05/2026,ENVIADO,15/05/26,KEVIN,TRES GUERRAS,
C08659,238503,JOSE ALFREDO PERALES GAMBOA,"ZACATECAS, ZAC",15/05/2026,ENVIADO,15/05/26,KEVIN,TRES GUERRAS,
C04135,238504,HOTEL VICTORIA,"CD. CONSTITUCION, BCS",15/05/2026,ENVIADO,15/05/26,KEVIN,TRES GUERRAS,
C00275,238505,HOTEL LAFAYETTE,"GUADALAJARA, JAL",15/05/2026,ENVIADO,15/05/26,FELIX,LOCAL,
C07087,238506,AZUL SIRENA,"SANTA CRUZ HUATULCO, OAX",15/05/2026,ENVIADO,15/05/26,KEVIN,TRES GUERRAS,
C08912,238507,SOLEARE HOTEL BOUTIQUE,"CD. MADERO, TAM",15/05/2026,ENVIADO,15/05/26,FELIX,TRES GUERRAS,
C04419,238508,AUTO HOTEL EL SUMIDERO,"TUXTLA GUTIERREZ, CHS",15/05/2026,ENVIADO,15/05/26,KEVIN,TRES GUERRAS,
C07255,238509,CITY PLUS MUNDO E (CPSTM),"TLANEPANTLA, CMX",15/05/2026,ENVIADO,15/05/26,KEVIN,TRES GUERRAS,
C02056,238510,EMPORIO MAZATLAN,"MAZATLAN, SIN",15/05/2026,ENVIADO,15/05/26,FELIX,TINY,
C00353,238511,EMPORIO VERACRUZ,"VERACRUZ, VER",15/05/2026,ENVIADO,15/05/26,KEVIN,TRES GUERRAS,
C07256,238512,CITY EXPRESS LA RAZA (CELRZ),"CIUDAD DE MEXICO, CMX",15/05/2026,ENVIADO,15/05/26,KEVIN,TRES GUERRAS,
CP0026,238513,MOTEL CALIFORNIA,"GUADALAJARA, JAL",15/05/2026,ENVIADO,15/05/26,FELIX,LOCAL,
C07431,238514,IBEROSTAR PLAYA PARAISO,"PLAYA DEL CARMEN, QR",,ENVIADO,15/05/26,,,CEDIS
C07431,238515,IBEROSTAR PLAYA PARAISO,"PLAYA DEL CARMEN, QR",,ENVIADO,15/05/26,,,CEDIS
C01774,238516,HOTEL STORE PUERTO VALLARTA,"BAHIA DE BANDERAS, NAY",,PENDIENTE,16/05/26,,SANCHEZ,16/17 viajan juntas
C01774,238517,HOTEL STORE PUERTO VALLARTA,"BAHIA DE BANDERAS, NAY",,PENDIENTE,16/05/26,,SANCHEZ,
C08939,238518,HOTEL WYNDHAM GRAND CANCUN ONLY INCLUSIVE RESORTS  &VILLAS,"CANCUN, QR",,PENDIENTE,,,,
C09650,238519,RESIDENCE INN MERIDA BY MARRIOTT ( 2613 ),"MERIDA, YUC",,PENDIENTE,,,,
C04501,238520,BARCELO HUATULCO,"HUATULCO, OAX",,PENDIENTE,,,,
C03072,238521,HOTEL MARIA DOLORES SAN LUIS,"SAN LUIS POTOSI, SLP",,PENDIENTE,,,,
C07822,238522,HYATT ZILARA CAPRI,"PLAYA DEL CARMEN, QR",,PENDIENTE,,,,
,238523,,,,ENVIADO,15/05/26,FELIX,LOCAL,
