NO CLIENTE,FACTURA,NOMBRE DEL CLIENTE,DESTINO,PROGRAMACION,ESTATUS,FECHA DE ENVIO,SURTIDOR,PAQUETERIA,INCIDENCIA
C07337,237981,HOTEL EXTENDED SUITES COATZACOALCOS FORUM,"COATZACOALCOS, VER",07/05/2026,ENVIADO,07/05/2026,KEVIN,TRES GUERRAS,
C07334,237982,EXTENDED SUITES CIUDAD DEL CARMEN AEROPUERTO,"DEL CARMEN, CAM",07/05/2026,ENVIADO,07/05/2026,KEVIN,TRES GUERRAS,
C07341,237984,EXTENDED SUITES CHIHUAHUA LA JUVENTUD,"CHIHUAHUA, CHI",07/05/2026,ENVIADO,07/05/2026,KEVIN,TRES GUERRAS,
C03362,237986,EXTENDED SUITES MERIDA,"MERIDA, YUC",07/05/2026,ENVIADO,07/05/2026,KEVIN,TRES GUERRAS,
C06946,237987,HOTEL SUITES AMD,"SAN JUAN DE LOS LAGOS, JAL",07/05/2026,ENVIADO,07/05/2026,KEVIN,TRES GUERRAS,
C02411,237989,LA QUINTA CD JUAREZ,"CD. JUAREZ, CHI",07/05/2026,ENVIADO,07/05/2026,KEVIN,TRES GUERRAS,
C08240,237990,STADIA SUITES MEXICO SANTA FE,"CUAJIMALPA DE MORELOS, CMX",07/05/2026,ENVIADO,07/05/2026,KEVIN,TRES GUERRAS,
C06129,237991,HOTEL SALON BAHIA,"TEXCOCO, MEX",07/05/2026,ENVIADO,07/05/2026,KEVIN,TRES GUERRAS,
C09005,237992,SAMSON WATERS,"PUERTO VALLARTA, JAL",07/05/2026,ENVIADO,07/05/2026,KEVIN,SANCHEZ,
C00696,237993,MOTEL MARQUIS,"TLAJOMULCO DE ZUÃƑÆ‘Ã†Â€˜ÃƑÂ€ŠÃ‚Â€ŠÂ¬Ã‹Å’IGA, JAL",07/05/2026,ENVIADO,07/05/2026,FELIX,LOCAL,
C09001,237994,MOTEL LOVE GDL,"GUADALAJARA, JAL",07/05/2026,ENVIADO,07/05/2026,KEVIN,LOCAL,
C07257,237995,CITY CENTRO CIUDAD DE MEXICO (CCMEX),"CIUDAD DE MEXICO, CMX",07/05/2026,ENVIADO,07/05/2026,KEVIN,TRES GUERRAS,
C08190,237996,MOTEL VILLAMAGNA,"JUAREZ, NL",07/05/2026,ENVIADO,07/05/2026,KEVIN,TRES GUERRAS,
C06416,237997,CHN MONTERREY AEROPUERTO,"APODACA, NL",07/05/2026,ENVIADO,07/05/2026,KEVIN,TRES GUERRAS,
C03447,237998,"HAMPTON GUADALAJARA-AEROPUERTO, MEXICO (GDLHA)","EL SALTO, JAL",07/05/2026,ENVIADO,07/05/2026,KEVIN,LOCAL,
C07037,237999,MICROTEL CULIACAN,"CULIACAN, SIN",07/05/2026,ENVIADO,07/05/2026,KEVIN,TINY,
C08341,238000,"DOUBLETREE MEXICO CITY SANTA FE, MEXICO (MEXST)",", CMX",07/05/2026,ENVIADO,07/05/2026,KEVIN,TRES GUERRAS,
C02052,238005,HOTEL SAN MARCOS,"SAN CRISTOBAL DE LAS CASAS, CHS",07/05/2026,ENVIADO,07/05/2026,KEVIN,TRES GUERRAS,
C03997,238006,HOTEL MARIELENA,"CUATROCIENEGAS, COA",07/05/2026,ENVIADO,07/05/2026,KEVIN,TRES GUERRAS,
CLIESP,238007,VENTAS DE MOSTRADOR,"GUADALAJARA, JAL",07/05/2026,ENVIADO,07/05/2026,KEVIN,LOCAL,
CG0024,238008,FARMASES,"MONTERREY, NL",07/05/2026,ENVIADO,12/05/2026,KEVIN,TRES GUERRAS,
C09286,238009,HOTEL BOUTIQUE FINCA GARULLO,"MARTINEZ DE LA TORRE, VER",07/05/2026,ENVIADO,07/05/2026,KEVIN,TRES GUERRAS,
C08070,238010,CROWNE PLAZA TOLUCA (TLUCP),"METEPEC, MEX",07/05/2026,ENVIADO,07/05/2026,KEVIN,ONE,
C00023,238011,HOTEL WESTIN GUADALAJARA A0096864,"GUADALAJARA, JAL",07/05/2026,ENVIADO,07/05/2026,FELIX,LOCAL,
C01663,238012,ARRENDADORA GALA,"LAZARO CARDENAS, MCH",07/05/2026,ENVIADO,07/05/2026,KEVIN,TRES GUERRAS,
C08692,238013,ANAIS JAZMIN ROSAS ESPARZA,"TLAJOMULCO DE ZUÃƑÆ‘Ã†Â€˜ÃƑÂ€ŠÃ‚Â€ŠÂ¬Ã‹Å’IGA, JAL",07/05/2026,ENVIADO,07/05/2026,KEVIN,LOCAL,
C09496,238014,HOTEL PARAISO EXPRESS,"TORREON COAHUILA, COA",07/05/2026,ENVIADO,07/05/2026,KEVIN,TINY,
CG0029,238015,HOTEL HACIENDA DEL ROBLE,"AGUASCALIENTES, AGS",07/05/2026,ENVIADO,07/05/2026,KEVIN,ONE,
C03135,238016,COURTYARD BY MARRIOTT LEON AT THE POLIFORUM  A0101010,"LEON, GTO",07/05/2026,ENVIADO,07/05/2026,KEVIN,TRES GUERRAS,
C03073,238017,COURTYARD MARRIOTT SAN LUIS POTOSI A0152894,"SAN LUIS POTOSI, SLP",07/05/2026,ENVIADO,07/05/2026,KEVIN,TRES GUERRAS,
C07159,238018,CITY EXPRESS TEPIC (CETPQ),"TEPIC, NAY",07/05/2026,ENVIADO,07/05/2026,KEVIN,TINY,
C08357,238019,"HILTON GUADALAJARA MIDTOWN, MEXICO (GDLGM)","GUADALAJARA, JAL",07/05/2026,ENVIADO,07/05/2026,KEVIN,LOCAL,
C04349,238020,COURTYARD MARRIOT QUERETARO A0093637,"SANTIAGO DE QUERETARO, QUE",07/05/2026,ENVIADO,07/05/2026,KEVIN,TRES GUERRAS,
CF0007,238021,REAL INN PERINORTE,"TLALNEPANTLA, MEX",07/05/2026,ENVIADO,07/05/2026,KEVIN,TRES GUERRAS,
C09366,238022,COMFORT INN PITIC HERMOSILLO (152792),"HERMOSILLO, SON",07/05/2026,ENVIADO,07/05/2026,KEVIN,TINY,
C01474,238025,COURTYARD MEXICO CITY REVOLUCION,"CDMX, CMX",07/05/2026,ENVIADO,07/05/2026,KEVIN,TRES GUERRAS,
C07058,238026,FAIRFIELD INN AND SUITES SILAO,"SILAO, GTO",07/05/2026,ENVIADO,07/05/2026,KEVIN,TRES GUERRAS,
C06597,238027,COUTYARD MARRIOT HERMOSILLO A0095790,"HERMOSILLO, SON",07/05/2026,ENVIADO,07/05/2026,KEVIN,TINY,
CP0015,238028,HOTEL MARIA JOSE,"ZAPOPAN, JAL",07/05/2026,ENVIADO,07/05/2026,KEVIN,LOCAL,
C02574,238030,HOTEL AEROPUERTO MORELIA,"MUNICIPIO ALVARO OBREGON, MCH",07/05/2026,ENVIADO,07/05/2026,KEVIN,TRES GUERRAS,
C07318,238031,CITY EXPRESS LOS MOCHIS (CELMM),"LOS MOCHIS, SIN",07/05/2026,ENVIADO,07/05/2026,KEVIN,TINY,
C08473,238032,"HILTON GARDEN INN MONTERREY OBISPADO, NUEVO LEON, MEXICO (MTYGI)","MONTERREY, NL",07/05/2026,ENVIADO,08/05/2026,KEVIN,ONE,
C08865,238033,JAVA MOTEL BOUTIQUE,"GUADALAJARA, JAL",07/05/2026,ENVIADO,08/05/2026,KEVIN,LOCAL,
C01509,238034,"CURIO - A COLLECTION BY HILTON MS MILENIUM MONTERREY, MEXICO (MTYMM)","SAN PEDRO GARZA GARCIA, NL",07/05/2026,ENVIADO,08/05/2026,KEVIN,TRES GUERRAS,
C05374,238035,"HAMPTON DURANGO, MEXICO (DGOHX)","DURANGO, DUR",07/05/2026,ENVIADO,08/05/2026,KEVIN,TRES GUERRAS,
C05503,238036,FIESTA AMERICANA GRAND LOS CABOS (FALC),"CABO SAN LUCAS, BCS",07/05/2026,ENVIADO,08/05/2026,FELIX,TRES GUERRAS,
C08383,238037,"HILTON GARDEN INN CHIHUAHUA, CHIHUAHUA, MEXICO (CUUCM)","CHIHUAHUA, CHI",07/05/2026,ENVIADO,08/05/2026,KEVIN,TRES GUERRAS,
C05481,238038,FIESTA AMERICANA GUADALAJARA FAGD,"GUADALAJARA, JAL",07/05/2026,ENVIADO,11/05/2026,KEVIN,TAMAZULA,
C05813,238039,SLEEP INN MONTERREY SAN PEDRO (143233),"MONTERREY, NL",07/05/2026,ENVIADO,08/05/2026,KEVIN,TRES GUERRAS,
C05503,238040,FIESTA AMERICANA GRAND LOS CABOS (FALC),"CABO SAN LUCAS, BCS",07/05/2026,ENVIADO,08/05/2026,FELIX,TRES GUERRAS,
C03977,238041,HOLIDAY INN EXPRESS CABO SAN LUCAS (SJDL),"CABO SAN LUCAS, BCS",07/05/2026,ENVIADO,08/05/2026,KEVIN,TRES GUERRAS,
C01774,238042,HOTEL STORE PUERTO VALLARTA,"BAHIA DE BANDERAS, NAY",07/05/2026,ENVIADO,11/05/2026,KEVIN,SANCHEZ,
C05503,238043,FIESTA AMERICANA GRAND LOS CABOS (FALC),"CABO SAN LUCAS, BCS",07/05/2026,ENVIADO,08/05/2026,FELIX,TRES GUERRAS,
C09529,238044,PRESIDENTE INTERCONTINENTAL MONTERREY,"SAN PEDRO GARZA GARCÃƑÆ‘Ã†Â€˜ÃƑÂ€ŠÃ‚ÂA, NL",07/05/2026,ENVIADO,08/05/2026,KEVIN,ONE,
C09544,238045,RED LOVE,"TIJUANA, BC",07/05/2026,CANCELADO,07/05/2026,CANCELADO,CANCELADO,
C04964,238046,HILTON GRAND VACATIONS LA PACIFICA LOS CABOS BY HILTON CLUB (SJDGV),"SAN JOSE DEL CABO, BCS",07/05/2026,ENVIADO,08/05/2026,KEVIN,TRES GUERRAS,
C08102,238047,DREAMS NATURA RIVIERA CANCUN (DRENA) A0191039,"CANCUN, QR",07/05/2026,ENVIADO,08/05/2026,KEVIN,TRES GUERRAS,
C08479,238048,AVID TIJUANA OTAY(TIJAV),"TIJUANA, BC",07/05/2026,ENVIADO,08/05/2026,KEVIN,TRES GUERRAS,
C05359,238049,FIESTA AMERICANA HERMOSILLO (FAHE),"HERMOSILLO, SON",07/05/2026,ENVIADO,07/05/2026,KEVIN,TRES GUERRAS,
C02569,238051,ONE GUADALAJARA CENTRO HISTORICO (1GDCE),"GUADALAJARA, JAL",07/05/2026,ENVIADO,11/05/2026,KEVIN,LOCAL,
C05503,238053,FIESTA AMERICANA GRAND LOS CABOS (FALC),"CABO SAN LUCAS, BCS",07/05/2026,ENVIADO,08/05/2026,FELIX,TRES GUERRAS,
C02635,238054,CITY EXPRESS CIUDAD DEL CARMEN (CECME ),"DEL CARMEN, CAM",07/05/2026,ENVIADO,11/05/2026,KEVIN,TRES GUERRAS,FACTURA ENVIADA CON 238074
C07245,238055,CITY EXPRESS TUXPAN (CETXP),"TUXPAN, VER",07/05/2026,ENVIADO,08/05/2026,FELIX,TRES GUERRAS,
C07391,238056,CITY EXPRESS PLUS TIJUANA TOREO (CPTIJ),"TIJUANA, BC",07/05/2026,ENVIADO,08/05/2026,KEVIN,TRES GUERRAS,
C08667,238057,HILTON QUERETARO,"QUERETARO, QUE",07/05/2026,ENVIADO,08/05/2026,KEVIN,TRES GUERRAS,
C02470,238058,ROYAL AUTO HOTEL,"MINATITLAN, VER",07/05/2026,ENVIADO,08/05/2026,KEVIN,TRES GUERRAS,
C08607,238059,HOTEL FLAMINGOS,"GUADALAJARA, JAL",07/05/2026,ENVIADO,09/05/2026,FELIX,LOCAL,
C08711,238060,CABAÃƑÆ‘Ã†Â€˜ÃƑÂ€ŠÃ‚Â€ŠÂ¬Ã‹Å’AS LUPITA,"MAZAMITLA, JAL",07/05/2026,ENVIADO,11/05/2026,KEVIN,TAMAZULA,
C09366,238061,COMFORT INN PITIC HERMOSILLO (152792),"HERMOSILLO, SON",07/05/2026,ENVIADO,07/05/2026,KEVIN,TINY,
C00353,238062,EMPORIO VERACRUZ,"VERACRUZ, VER",07/05/2026,ENVIADO,08/05/2026,KEVIN,TRES GUERRAS,
C07246,238063,CITY PLUS GUADALAJARA PALOMAR (CEGDP),"TLAJOMULCO DE ZUÃƑÆ‘Ã†Â€˜ÃƑÂ€ŠÃ‚Â€ŠÂ¬Ã‹Å’IGA, JAL",07/05/2026,ENVIADO,09/05/2026,FELIX,LOCAL,
C07879,238064,HOLIDAY INN EXPRESS & SUITES MONTERREY SENDERO NORTE,"CDAD. GRAL. ESCOBEDO, NL",07/05/2026,CANCELADO,07/05/2026,CANCELADO,CANCELADO,CANCELADA POR CYNTHIA
C05991,238065,VN HOTEL,"MONTERREY, NL",07/05/2026,ENVIADO,08/05/2026,KEVIN,TRES GUERRAS,
C02081,238066,EMPORIO ZACATECAS,"ZACATECAS, ZAC",07/05/2026,ENVIADO,08/05/2026,KEVIN,TRES GUERRAS,
C04827,238067,"HILTON SAN LUIS POTOSI, MEXICO (SLPHH)","SAN LUIS POTOSI, SLP",07/05/2026,ENVIADO,08/05/2026,KEVIN,TRES GUERRAS,
C03764,238068,HOLIDAY INN MONTERREY VALLE(MTYZV),"SAN PEDRO GARZA GARCIA, NL",07/05/2026,ENVIADO,08/05/2026,KEVIN,TRES GUERRAS,
C02400,238069,CASA INN PREMIUM HOTEL QUERETARO,"EL MARQUES, QUE",07/05/2026,ENVIADO,08/05/2026,KEVIN,TRES GUERRAS,
C08637,238070,HOTEL LA ESTANCIA,"ZAPOPAN, JAL",07/05/2026,ENVIADO,08/05/2026,KEVIN,LOCAL,
C09117,238071,GRAND CATALAGUA,"MORELIA, MCH",07/05/2026,ENVIADO,08/05/2026,KEVIN,TRES GUERRAS,
C07280,238072,CITY EXPRESS MONTERREY SANTA CATARINA (CEMTY),"SANTA CATARINA, NL",07/05/2026,ENVIADO,09/05/2026,FELIX,PAQMEX,
C08429,238073,CITY EXPRES PLUS MEXICALI (CPMXL),"MEXICALI, BC",07/05/2026,ENVIADO,08/05/2026,KEVIN,TRES GUERRAS,
C02635,238074,CITY EXPRESS CIUDAD DEL CARMEN (CECME ),"DEL CARMEN, CAM",07/05/2026,ENVIADO,08/05/2026,KEVIN,TRES GUERRAS,FACTURA ENVIADA CON 238054
C01770,238075,CITY EXPRESS TEPOTZOTLAN (CETPO),"TEPOTZOTLAN, MEX",07/05/2026,ENVIADO,08/05/2026,KEVIN,TRES GUERRAS,
C07879,238076,HOLIDAY INN EXPRESS & SUITES MONTERREY SENDERO NORTE,"CDAD. GRAL. ESCOBEDO, NL",07/05/2026,ENVIADO,08/05/2026,KEVIN,TRES GUERRAS,
C01774,238079,HOTEL STORE PUERTO VALLARTA,"BAHIA DE BANDERAS, NAY",08/05/2026,ENVIADO,11/05/2026,KEVIN,SANCHEZ,
C00169,238081,HOTEL LA FINCA,"CATEMACO, VER",08/05/2026,ENVIADO,08/05/2026,KEVIN,TRES GUERRAS,
C09640,238082,CITY JUNIOR ZONA INDUSTRIAL (CJTCC),"TOLUCA, DF2",08/05/2026,ENVIADO,08/05/2026,KEVIN,TRES GUERRAS,
C07268,238083,CITY EXPRESS GUSTAVO BAZ (CEBAZ),"TLANEPANTLA, MEX",08/05/2026,ENVIADO,08/05/2026,KEVIN,TRES GUERRAS,
C07164,238084,CITY JUNIOR VILLAHERMOSA (CJVSA),"VILLAHERMOSA, TAB",08/05/2026,ENVIADO,08/05/2026,KEVIN,TRES GUERRAS,
C07241,238085,CITY EXPRESS MATAMOROS (CEMAT),"MATAMOROS, TAM",08/05/2026,ENVIADO,09/05/2026,FELIX,PAQMEX,
C07418,238086,CITY EXPRESS PLUS INTERLOMAS (CPINT),"HUIXQUILUCAN, CMX",08/05/2026,ENVIADO,08/05/2026,KEVIN,TRES GUERRAS,
C07223,238088,CITY JUNIOR GUADALAJARA PERIFERICO SUR (CJGPS),"TLAQUEPAQUE, JAL",08/05/2026,ENVIADO,09/05/2026,FELIX,LOCAL,
C07318,238089,CITY EXPRESS LOS MOCHIS (CELMM),"LOS MOCHIS, SIN",08/05/2026,ENVIADO,08/05/2026,KEVIN,TINY,
C07221,238090,CITY JUNIOR TIJUANA OTAY (CJTIO),"TIJUANA, BC",08/05/2026,ENVIADO,08/05/2026,KEVIN,TRES GUERRAS,
C07351,238091,CITY EXPRESS SALTILLO SUR (CESLW),"SALTILLO, COA",08/05/2026,ENVIADO,08/05/2026,KEVIN,TRES GUERRAS,
C07278,238092,CITY EXPRESS QUERETARO (CEQRO),"QUERETARO, QUE",08/05/2026,ENVIADO,08/05/2026,KEVIN,TRES GUERRAS,
C07401,238093,CITY EXPRESS ENSENADA (CEESE),"ENSENADA, BC",08/05/2026,ENVIADO,08/05/2026,KEVIN,TRES GUERRAS,
C07159,238094,CITY EXPRESS TEPIC (CETPQ),"TEPIC, NAY",08/05/2026,ENVIADO,08/05/2026,KEVIN,TINY,
C07266,238095,CITY EXPRESS VERACRUZ (CEVER),"BOCA DEL RIO, VER",08/05/2026,ENVIADO,08/05/2026,KEVIN,TRES GUERRAS,
C07589,238096,CITY EXPRESS CENTRAL DE ABASTOS (CECEA),"CIUDAD DE MEXICO, CMX",08/05/2026,ENVIADO,08/05/2026,KEVIN,TRES GUERRAS,
C07307,238097,CITY EXPRESS SALTILLO NORTE (CESAL),"SALTILLO, COA",08/05/2026,ENVIADO,08/05/2026,KEVIN,TRES GUERRAS,
C07304,238099,CITY EXPRESS MONTERREY AEROPUERTO (CEMTA),"APODACA, NL",08/05/2026,ENVIADO,08/05/2026,KEVIN,TRES GUERRAS,
C07575,238100,CITY EXPRESS PLUS PATIO UNIVERSITARIO (CEPUN),"BENITO JUAREZ, CMX",08/05/2026,ENVIADO,08/05/2026,KEVIN,TRES GUERRAS,
C07214,238101,CITY EXPRESS CAMPECHE (CECPE),"SAN FRANCISCO DE CAMPECHE, CAM",08/05/2026,ENVIADO,08/05/2026,KEVIN,TRES GUERRAS,
C05754,238102,HOLIDAY INN EXPRESS & SUITES MONTERREY VALLE (MTYRR),"SAN PEDRO GARZA GARCIA, NL, NL",08/05/2026,ENVIADO,08/05/2026,KEVIN,TRES GUERRAS,
C08091,238103,HOLIDAY INN EXPRESS & SUITES CELAYA (BJXCE),"CELAYA, GTO",08/05/2026,ENVIADO,08/05/2026,KEVIN,TRES GUERRAS,
C08700,238104,AUTOHOTEL VILLAVERDE,"VILLAHERMOSA CENTRO, TAB",08/05/2026,ENVIADO,08/05/2026,KEVIN,TRES GUERRAS,
C03428,238105,HOLIDAY INN BUENAVISTA (MEXBU),"CUAUHTEMOC, CMX",08/05/2026,ENVIADO,08/05/2026,FELIX,TRES GUERRAS,
C08267,238106,MICROTEL GUADALAJARA SUR,"TLAJOMULCO DE ZUÃƑÆ‘Ã‚Â‚¬ËŒIGA, JAL",08/05/2026,ENVIADO,09/05/2026,FELIX,LOCAL,
C07187,238107,CITY EXPRESS IRAPUATO (CEIRA),"IRAPUATO, GTO",08/05/2026,ENVIADO,08/05/2026,KEVIN,TRES GUERRAS,
C05818,238108,RAMADA ENCORE PUEBLA A0191476,"CORONANGO, PUE",08/05/2026,ENVIADO,08/05/2026,KEVIN,TRES GUERRAS,
C07020,238109,ENCORE AGUASCALIENTES A0191473,"AGUASCALIENTES, AGS",08/05/2026,ENVIADO,08/05/2026,KEVIN,TRES GUERRAS,
C07171,238110,CITY EXPRESS SALINA CRUZ (CESCX),"SALINA CRUZ, OAX",08/05/2026,ENVIADO,08/05/2026,KEVIN,TRES GUERRAS,
CLIESP,238111,VENTAS DE MOSTRADOR,"GUADALAJARA, JAL",08/05/2026,ENVIADO,08/05/2026,KEVIN,LOCAL,
C07277,238113,CITY EXPRESS CANANEA (CECNA),"CANANEA, SON",08/05/2026,ENVIADO,08/05/2026,KEVIN,TINY,
C07574,238114,CITY EXPRESS CELAYA (CECEL),"CELAYA, GTO",08/05/2026,ENVIADO,08/05/2026,KEVIN,TRES GUERRAS,
C07183,238115,CITY EXPRESS COMITAN (CECJT),"COMITÃƑÆ‘Ã‚ÂN DE DOMÃƑÆ‘Ã‚ÂNGUEZ, CHS",08/05/2026,ENVIADO,08/05/2026,KEVIN,TRES GUERRAS,
C07384,238117,CITY EXPRESS TLALPAN (CETLA),"MEXICO, CMX",11/05/2026,ENVIADO,11/05/2026,YAZMIN,TRES GUERRAS,
C08067,238118,CITY EXPRESS DE LAGOS DE MORENO (CELDM),"LAGOS DE MORENO, JAL",11/05/2026,ENVIADO,11/05/2026,YAZMIN,TRES GUERRAS,
C07450,238119,CITY EXPRESS LA VILLA (CEVIL),"CIUDAD DE MEXICO, CMX",11/05/2026,ENVIADO,11/05/2026,YAZMIN,TRES GUERRAS,
C07188,238120,CITY EXPRESS LEON (CELEO),"LEON, GTO",11/05/2026,ENVIADO,11/05/2026,YAZMIN,TRES GUERRAS,
C07189,238121,CITY EXPRESS MANZANILLO (CEZLO),"MANZANILLO, COL",11/05/2026,ENVIADO,11/05/2026,YAZMIN,TRES GUERRAS,
C07240,238122,CITY EXPRESS PLUS MONTERREY SUR (CEMTR),"MONTERREY, NL",11/05/2026,ENVIADO,11/05/2026,YAZMIN,TRES GUERRAS,
C02639,238124,AQUA SAN MIGUEL DE ALLENDE (FAQSM),"SAN MIGUEL DE ALLENDE, GTO",11/05/2026,ENVIADO,11/05/2026,KEVIN,TRES GUERRAS,
C07279,238127,CITY EXPRESS TUXTLA GUTIERREZ (CETGZ),"TUXTLA GUTIERREZ, CHS",11/05/2026,ENVIADO,11/05/2026,YAZMIN,TRES GUERRAS,
C07199,238128,CITY EXPRESS NUEVO LAREDO (CENLD),"NUEVO LAREDO, TAM",11/05/2026,ENVIADO,11/05/2026,YAZMIN,TRES GUERRAS,
C08139,238129,CITY EXPRESS XALAPA (CEJAL),"XALAPA, VER",11/05/2026,ENVIADO,11/05/2026,YAZMIN,TRES GUERRAS,
C07243,238130,CITY PLUS CABO SAN LUCAS (CECSL),"CABO SAN LUCAS, BCS",11/05/2026,ENVIADO,11/05/2026,YAZMIN,TRES GUERRAS,
C09421,238131,GRUPO AGC,"GUADALAJARA, JAL",11/05/2026,ENVIADO,11/05/26,YAZMIN,TRES GUERRAS,
C07212,238132,CITY PLUS PERIFERICO SUR TLALPAN (CPPST),"TLALPAN, DF2",11/05/2026,ENVIADO,11/05/2026,YAZMIN,TRES GUERRAS,
C02297,238133,CITY EXPRESS MERIDA (CEMID),"MERIDA, YUC",11/05/2026,ENVIADO,11/05/2026,YAZMIN,TRES GUERRAS,
C07205,238134,CITY JUNIOR TUXTEPEC (CJTUX),"SAN JUAN BAUTISTA TUXTEPEC, OAX",11/05/2026,ENVIADO,11/05/2026,KEVIN,CASTORES,
C01721,238136,CITY EXPRESS TAMPICO (CETAM),"TAMPICO, TAM",11/05/2026,ENVIADO,11/05/2026,YAZMIN,TRES GUERRAS,
C07208,238137,CITY JUNIOR SAN LUIS ZONA INDUSTRIAL (CJSLI),"SAN LUIS POTOSI, SLP",11/05/2026,ENVIADO,11/05/2026,YAZMIN,TRES GUERRAS,
C08865,238138,JAVA MOTEL BOUTIQUE,"GUADALAJARA, JAL",11/05/2026,ENVIADO,11/05/2026,KEVIN,LOCAL,
C08676,238139,HOTEL BARUK GUADALAJARA,"GUADALAJARA, JAL",11/05/2026,ENVIADO,11/05/2026,KEVIN,LOCAL,
C07209,238140,CITY JUNIOR MEXICALI (CJMXL),"MEXICALI, BC",11/05/2026,ENVIADO,11/05/2026,KEVIN,TRES GUERRAS,
C05029,238141,BAYMONT INN & SUITES,"LAZARO CARDENAS, MCH",11/05/2026,ENVIADO,11/05/2026,KEVIN,TRES GUERRAS,
C01365,238142,HOTEL MORALES,"GUADALAJARA, JAL",11/05/2026,ENVIADO,11/05/2026,KEVIN,LOCAL,
C07369,238143,HOTEL CORONA,"EL GRULLO, JAL",11/05/2026,ENVIADO,11/05/2026,KEVIN,TAMAZULA,
C07190,238144,CITY JUNIOR MERIDA ALTABRISA (CJMID),"MERIDA, YUC",11/05/2026,ENVIADO,11/05/2026,YAZMIN,TRES GUERRAS,
C09736,238145,HOTEL JARDIN DEL CENTRO,"CHIHUAHUA, CHI",11/05/2026,ENVIADO,11/05/2026,YAZMIN,TRES GUERRAS,
C01774,238147,HOTEL STORE PUERTO VALLARTA,"BAHIA DE BANDERAS, NAY",11/05/2026,ENVIADO,11/05/2026,KEVIN,SANCHEZ,
C03115,238149,PRESIDENTE INTERCONTINENTAL GUADALAJARA,"ZAPOPAN, JAL",11/05/2026,CANCELADO,11/05/2026,CANCELADO,CANCELADO,CANCELADO POR CYNTHIA
C03306,238151,HOTEL NEKIE,"TEPIC, NAY",11/05/2026,ENVIADO,12/05/2026,FELIX,TINY,
C07242,238152,CITY EXPRESS SALAMANCA (CESLM),"SALAMANCA, GTO",11/05/2026,ENVIADO,11/05/2026,YAZMIN,TRES GUERRAS,
C07264,238155,CITY CENTRO OAXACA (CCOAX),"OAXACA, OAX",11/05/2026,ENVIADO,11/05/2026,YAZMIN,TRES GUERRAS,
C02613,238156,HARD ROCK HOTEL GUADALAJARA,"ZAPOPAN, JAL",11/05/2026,ENVIADO,12/05/2026,FELIX,LOCAL,
C09328,238157,COMSAN,"MAZATLAN, SIN",11/05/2026,ENVIADO,11/05/2026,YAZMIN,TRES GUERRAS,
C09328,238158,COMSAN,"HERMOSILLO, SON",11/05/2026,ENVIADO,11/05/2026,YAZMIN,TRES GUERRAS,
C01762,238159,DISTRIBUIDORA JOFA,"TIJUANA, BC",11/05/2026,ENVIADO,12/05/2026,FELIX,TRES GUERRAS,
C08292,238160,HOTEL FRESNO GALERIAS,"TORREON, COA",11/05/2026,PENDIENTE,,,,
CG0024,238161,FARMASES,"MONTERREY, NL",11/05/2026,PENDIENTE,,,,
C09428,238162,INSUMOS DE LIMPIEZA E HIGIENE,"TUXTLA GUTIERREZ, CHS",11/05/2026,ENVIADO,12/05/2026,FELIX,TRES GUERRAS,
C07226,238163,CITY JUNIOR TUXTLA GUTIERREZ POLIFORUM (CJTGZ),"TUXTLA GUTIERREZ, CHS",11/05/2026,ENVIADO,12/05/2026,FELIX,TRES GUERRAS,
C07411,238164,CITY EXPRESS PLUS MERIDA (CPMID),"MERIDA, YUC",11/05/2026,ENVIADO,12/05/2026,FELIX,TRES GUERRAS,
C07211,238165,CITY EXPRESS CIUDAD VICTORIA (CECVM),"VICTORIA, TAM",11/05/2026,ENVIADO,12/05/2026,FELIX,PAQMEX,
C07209,238166,CITY JUNIOR MEXICALI (CJMXL),"MEXICALI, BC",11/05/2026,ENVIADO,12/05/2026,FELIX,TRES GUERRAS,
C07249,238167,CITY JUNIOR AGUASCALIENTES CENTRO (CJAGU),"AGUASCALIENTES, AGS",11/05/2026,ENVIADO,12/05/2026,FELIX,TRES GUERRAS,
C08714,238168,HELIOS COLOMBIA,", BOG",11/05/2026,ENVIADO,11/05/2026,KEVIN,EXPORTACION,
C07282,238169,CITY PLUS GUADALAJARA EXPO (CEEGD),"ZAPOPAN, JAL",11/05/2026,PENDIENTE,,,,
C07116,238170,CABIN GROUP,"GUADALAJARA, JAL",11/05/2026,PENDIENTE,,,,
C07608,238171,CITY EXPRESS PLUS EBC REFORMA (CEEBC),"CIUDAD DE MEXICO, DF2",11/05/2026,ENVIADO,12/05/2026,FELIX,TRES GUERRAS,
C07233,238172,CITY JUNIOR PUEBLA FINSA (CJPAU),"CUAUTLANCINGO, PUE",11/05/2026,ENVIADO,12/05/2026,FELIX,TRES GUERRAS,
C08137,238173,CITY PLUS LEON CENTRO DE CONVENCIONES (CPLEO),"LEON, GTO",11/05/2026,ENVIADO,12/05/2026,FELIX,TRES GUERRAS,
C07263,238174,CITY EXPRESS PUEBLA ANGELOPOLIS (CEPAN),"PUEBLA, PUE",11/05/2026,ENVIADO,12/05/2026,FELIX,TRES GUERRAS,
C07316,238175,CITY EXPRESS REYNOSA (CEREX),"REYNOSA, TAM",11/05/2026,ENVIADO,12/05/2026,FELIX,PAQMEX,
C07272,238176,CITY EXPRESS CULIACAN (CECUL),"CULIACAN, SIN",11/05/2026,PENDIENTE,,,,
CLIESP,238177,VENTAS DE MOSTRADOR,"GUADALAJARA, JAL",11/05/2026,ENVIADO,11/05/2026,YAZMIN,LOCAL,
C02296,238178,CITY EXPRESS NOGALES (CENOG),"NOGALES, SON",11/05/2026,ENVIADO,12/05/2026,FELIX,TRES GUERRAS,
C07320,238179,CITY EXPRESS TIJUANA INSURGENTES (CETII),"TIJUANA, BC",11/05/2026,ENVIADO,12/05/2026,FELIX,TRES GUERRAS,
C08179,238180,CITY JUNIOR CENTRO DE CONVENCIONES (CJLEO),"LEON, GTO",11/05/2026,ENVIADO,12/05/2026,FELIX,TRES GUERRAS,
C07191,238181,CITY EXPRESS REYNOSA AEROPUERTO (CEREA),"REYNOSA, TAM",11/05/2026,ENVIADO,12/05/2026,FELIX,PAQMEX,
C07196,238182,CITY JUNIOR CIUDAD DEL CARMEN AEROPUERTO (CJCMI),"CIUDAD DEL CARMEN, CAM",11/05/2026,ENVIADO,12/05/2026,FELIX,TRES GUERRAS,
C07391,238183,CITY EXPRESS PLUS TIJUANA TOREO (CPTIJ),"TIJUANA, BC",11/05/2026,ENVIADO,12/05/2026,FELIX,TRES GUERRAS,
C08714,238184,HELIOS COLOMBIA,", BOG",11/05/2026,ENVIADO,11/05/2026,YAZMIN,EXPORTACION,
C07215,238185,CITY SUITES ANZURES (CSANZ),"CIUDAD DE MEXICO, CMX",11/05/2026,ENVIADO,12/05/2026,FELIX,TRES GUERRAS,
C01722,238186,CITY EXPRESS MEXICALI (CEMXL),"MEXICALI, BC",11/05/2026,ENVIADO,12/05/2026,FELIX,TRES GUERRAS,
C07184,238187,CITY EXPRESS SAN LUIS POTOSI ZONA INDUSTRIAL (CESLP),"SAN LUIS POTOSI, SLP",11/05/2026,ENVIADO,12/05/2026,FELIX,TRES GUERRAS,
C07237,238188,CITY EXPRESS SAN LUIS POTOSI ZONA UNIVERSITARIA (CESLU),"SAN LUIS POTOSI, SLP",11/05/2026,ENVIADO,12/05/2026,FELIX,TRES GUERRAS,
CLIESP,238189,VENTAS DE MOSTRADOR,"GUADALAJARA, JAL",11/05/2026,PENDIENTE,,,,
C02016,238190,CITY EXPRESS ZACATECAS (CEZCL),"ZACATECAS, ZAC",11/05/2026,ENVIADO,12/05/2026,FELIX,TRES GUERRAS,
C08792,238191,HOTEL AVID GUADALAJARA (GDLAV),"ZAPOPAN, JAL",11/05/2026,PENDIENTE,,,,
C07738,238192,XINU,"CIUDAD DE MEXICO, CMX",11/05/2026,PENDIENTE,,,,
C03079,238193,HOTEL EL PARAISO MINERAL DEL CHICO,"PACHUCA, HID",11/05/2026,CANCELADO,11/05/2026,CANCELADO,CANCELADO,
C07155,238194,CITY PLUS INSURGENTES SUR (CEINS),"CIUDAD DE MÃƑÂ€°XICO, DF2",11/05/2026,ENVIADO,12/05/2026,FELIX,TRES GUERRAS,
C09328,238195,COMSAN,"HERMOSILLO, SON",11/05/2026,ENVIADO,11/05/2026,FELIX,TINY,
C09328,238196,COMSAN,"MAZATLAN, SIN",11/05/2026,PENDIENTE,,,,
C07206,238197,CITY SUITES TIJUANA RIO (CSTIR),"TIJUANA, BC",11/05/2026,ENVIADO,12/05/2026,FELIX,TRES GUERRAS,
C08539,238198,CITY EXPRESS MONTERREY UNIVERSIDAD (CEMTS),"MONTERREY, NL",11/05/2026,ENVIADO,11/05/2026,FELIX,ONE,
C01920,238199,CITY PLUS REFORMA DEL ANGEL (CEANG),"MEXICO, CMX",11/05/2026,PENDIENTE,,,,
C07240,238200,CITY EXPRESS PLUS MONTERREY SUR (CEMTR),"MONTERREY, NL",11/05/2026,PENDIENTE,,,,
C07639,238201,CITY EXPRESS HERMOSILLO EXPO (CEHME),"HERMOSILLO, SON",11/05/2026,PENDIENTE,,,,
C08931,238202,SUITE & HOTEL CAMELINAS,"LAZARO CARDENAS, MCH",11/05/2026,ENVIADO,12/05/2026,FELIX,TRES GUERRAS,
C07232,238203,CITY EXPRESS IRAPUATO NORTE (CEIRN),"IRAPUATO, GTO",11/05/2026,ENVIADO,12/05/2026,FELIX,TRES GUERRAS,
C08350,238204,"HILTON GARDEN INN PUEBLA ANGELÃƑÂ€ŒPOLIS, MEXICO (PBCGI)","SAN ANDRES, PUE",11/05/2026,ENVIADO,12/05/2026,FELIX,TRES GUERRAS,
C02572,238205,ONE GUADALAJARA PERIFERICO NORTE (1GDPN),"ZAPOPAN, JAL",11/05/2026,ENVIADO,12/05/2026,FELIX,LOCAL,
CG0024,238206,FARMASES,"MONTERREY, NL",12/05/2026,PENDIENTE,,,,
C07203,238207,CITY EXPRESS HERMOSILLO (CEHMO),"HERMOSILLO, SON",11/05/2026,PENDIENTE,,,,
C08325,238208,COURTYARD MARRIOTT MEXICALI A0157920,"MEXICALI, BC",11/05/2026,PENDIENTE,,,,
C07203,238209,CITY EXPRESS HERMOSILLO (CEHMO),"HERMOSILLO, SON",11/05/2026,PENDIENTE,,,,
C04827,238210,"HILTON SAN LUIS POTOSI, MEXICO (SLPHH)","SAN LUIS POTOSI, SLP",11/05/2026,ENVIADO,12/05/2026,FELIX,TRES GUERRAS,
C04484,238211,CROWNE PLAZA MONTERREY AEROPUERTO(MTYCP),"MONTERREY, NL",11/05/2026,ENVIADO,13/05/2026,FELIX,TRES GUERRAS,
C08025,238212,HOTEL RAME,"GUADALAJARA, JAL",11/05/2026,ENVIADO,12/05/2026,FELIX,LOCAL,
C07252,238213,CITY EXPRESS CIUDAD DE MEXICO ALAMEDA (CEALM),"CUAUHTEMOC, CMX",11/05/2026,PENDIENTE,,,,
C09602,238214,COURTYARD TIJUANA,"TIJUANA, BC",11/05/2026,PENDIENTE,,,,
C09602,238215,COURTYARD TIJUANA,"TIJUANA, BC",11/05/2026,PENDIENTE,,,,
C07156,238216,CITY EXPRESS OAXACA (CEOAX),"OAXACA DE JUAREZ, OAX",11/05/2026,ENVIADO,12/05/2026,FELIX,TRES GUERRAS,
C08301,238217,CLICK EFFICIENCY COURTYARD PUEBLA LAS ANIMAS A0089983,"PUEBLA, PUE",11/05/2026,ENVIADO,12/05/2026,FELIX,ONE,
C01624,238218,WYNDHAM GARDEN PLAYA DEL CARMEN(CUNPL) A0090463,"PLAYA DEL CARMEN, QR",11/05/2026,PENDIENTE,,,,
C08798,238219,DAC,"PLAYA DEL CARMEN, QR",11/05/2026,PENDIENTE,,,,
C05754,238220,HOLIDAY INN EXPRESS & SUITES MONTERREY VALLE (MTYRR),"SAN PEDRO GARZA GARCIA, NL, NL",11/05/2026,ENVIADO,12/05/2026,FELIX,TRES GUERRAS,
C01176,238221,HOLIDAY INN LEON A0194693 (BJXEX),"LEON, GTO",11/05/2026,ENVIADO,12/05/2026,FELIX,ONE,
CG0024,238222,FARMASES,"MONTERREY, NL",11/05/2026,PENDIENTE,,,,
C08530,238223,HOLIDAY INN EXPRESS CULIACAN (CULPY),"CULIACAN, SIN",11/05/2026,PENDIENTE,,,,
C05221,238224,RAMADA BY WIDHAM PERINORTE,"TLALNEPANTLA DE BAZ, CMX",11/05/2026,ENVIADO,12/05/2026,FELIX,ONE,
C08140,238225,CITY EXPRESS MAZATLAN (CEMZT),"MAZATLAN, SIN",11/05/2026,PENDIENTE,,,,
C04834,238226,"HAMPTON MONTERREY/GALERIAS-OBISPADO, MEXICO (MTYGA)","MONTERREY, NL",11/05/2026,PENDIENTE,,,,
C00030,238227,ALOFT GUADALAJARA SUR (GDLPU 5528),"TLAJOMULCO DE ZUÃƑÂ€˜IGA, JAL",11/05/2026,ENVIADO,14/05/2026,KEVIN,LOCAL,
C08147,238228,CITY EXPRESS PLUS SANTA FE (CESFE),"CUAJIMALPA DE MORELOS, DF2",11/05/2026,ENVIADO,12/05/2026,FELIX,TRES GUERRAS,
C01348,238229,SUITES NAVATAA,"GUADALAJARA, JAL",11/05/2026,ENVIADO,14/05/2026,FELIX,LOCAL,
C00237,238230,INDIGO GUADALARA (GDLAL),"GUADALAJARA, JAL",11/05/2026,ENVIADO,12/05/2026,FELIX,LOCAL,
C07255,238231,CITY PLUS MUNDO E (CPSTM),"TLANEPANTLA, CMX",11/05/2026,ENVIADO,12/05/2026,FELIX,TRES GUERRAS,
C07253,238232,CITY EXPRESS ROSARITO (CEROS),"PLAYAS DE ROSARITO, BC",11/05/2026,ENVIADO,12/05/2026,FELIX,TRES GUERRAS,
C03280,238233,REAL INN TIJUANA,"TIJUANA, BC",11/05/2026,ENVIADO,12/05/2026,FELIX,TRES GUERRAS,
C09412,238234,REAL INN CELAYA,"CELAYA, GTO",11/05/2026,ENVIADO,12/05/2026,FELIX,TRES GUERRAS,
C06384,238235,FAIRFIELD INN & SUITES AGUASCALIENTES,"AGUASCALIENTES, AGS",11/05/2026,ENVIADO,12/05/2026,FELIX,TRES GUERRAS,
C01133,238236,HOTEL MESON EJECUTIVO,"GUADALAJARA, JAL",11/05/2026,ENVIADO,13/05/2026,KEVIN,LOCAL,
C05301,238237,HOTEL DEL PORTAL,"PUEBLA, PUE",11/05/2026,ENVIADO,12/05/2026,FELIX,ONE,
C08120,238238,MOTEL LOMA LINDA,"SAN PEDRO TLAQUEPAQUE, JAL",11/05/2026,ENVIADO,12/05/2026,FELIX,LOCAL,
C00568,238239,HOTEL MALIBU,"ZAPOPAN, JAL",11/05/2026,ENVIADO,12/05/2026,FELIX,LOCAL,
C07247,238240,CITY EXPRESS PIEDRAS NEGRAS (CEPDS),"PIEDRAS NEGRAS, COA",11/05/2026,ENVIADO,12/05/2026,FELIX,TRES GUERRAS,
