FECHA,FECHA_FIN,IMPORTANCIA,TAREA,ULTIMO ACCION,PROGRESO,DEPENDENCIAS,TIPO,GRUPO
2026-01-27,2026-01-30,Media,REVISAR EMBARQUE MERIDA CEDIS,EN TRANSITO ,50,None,Tarea,LOGISTICA
2026-01-30,2026-02-02,Alta,ACTUALIZAR QUEJAS,EN PROCESO,50,T1,Tarea,LOGISTICA
2026-01-31,2026-02-03,Urgente,MANDAR BOTELLA DE REGALO DE CARLOS FIALKO,PENDIENTE ENVIO,50,T2,Hito,LOGISTICA
2026-02-03,2026-02-03,Alta,PEDIR ESTATUS A ONE PAQUETERIA,SIN INICIAR,10,None,Hito,SEGUIMIENTO
2026-02-03,2026-02-03,Media,VISITA DE SOFI,SIN INICIAR,10,T5,Hito,SEGUIMIENTO
2026-02-03,2026-02-03,Alta,EMPIEZA PRUEBA PILOTO CON POTOSINOS,EN PROCESO,80,T4,Hito,PROYECTOS
