USUARIO,FECHA,FECHA_FIN,IMPORTANCIA,TAREA,ULTIMO ACCION,PROGRESO,DEPENDENCIAS,TIPO,GRUPO
RIGOBERTO,2026-03-19,2026-03-23,Alta,"GLZ02840335 - NO RECIBIO PORQUE NO ES SU PEDIDO
",SE REGRESA TALON A GDL,90,,Tarea,ENTREGAS PENDIENTES
RIGOBERTO,2026-03-18,2026-03-18,Alta,GLZ02858995 - 235635 - CLIENTE RECHAZO PEDIDO SE REPROGRAMA ,EN PROCESO,50,,Tarea,ENTREGAS PENDIENTES
Rigoberto Hdz,2026-03-20,2026-03-21,Urgente,"[NEX-003] DOC: 235970 | GUIA: GDL 54443 | CLIENTE: SLEEP INN CULIACAN (143225) | DESTINO: CULIACAN, SIN",CLIENTE NO QUIZO RECIBIR PEDIDO,80,,Tarea,ENTREGAS PENDIENTES
Rigoberto Hernández,2026-03-23,2026-03-25,Alta,[NEX-004] MANDAR PRODUCTO A ECODELI,EN ESPERA DE SURTIDO DE ALMACEN,55,,Tarea,ENVIOS PENDIENTES
Rigoberto Hernández,2026-03-23,2026-03-28,Urgente,"[NEX-005] DOC: 234887 | GUIA: GD 3465673 | CLIENTE: CROWNE PLAZA TORREON(MILENIUM) (TRCRZ) | DESTINO: TORREON, COA",TINY PACK EXTRAVIO EL PRODUCTO,80,,Tarea,ENTREGAS PENDIENTES
Rigoberto Hernández,2026-03-25,2026-03-26,Media,"[NEX-006] DOC: 236294 | GUIA: 0 | CLIENTE: HOTEL POSADA SAN MARTIN | DESTINO: ENSENADA, BC","SE MANDA OCURRE? COSTO ESPECIAL DE $5,980",0,,Tarea,ENTREGAS PENDIENTES
